Name,Description,X,Avatar,Topics,Works at,Role,Papers
Sergey Levine,"Computer Scientist at University of California, Berkeley",https://x.com/svlevine,https://api.dicebear.com/9.x/initials/svg?seed=Sergey%20Levine&fontWeight=700&radius=16,Reinforcement Learning; Computer Science; Artificial Intelligence; Machine Learning,"University of California, Berkeley",Computer Scientist,Model-Agnostic Meta-Learning for Fast Adaptation of Deep Networks; Soft Actor-Critic: Off-Policy Maximum Entropy Deep Reinforcement Learning with a Stochastic Actor; Trust Region Policy Optimization; Soft Actor-Critic Algorithms and Applications; High-Dimensional Continuous Control Using Generalized Advantage Estimation
Neil Lawrence,Chief Scientist at University of Cambridge,https://x.com/lawrennd,https://api.dicebear.com/9.x/initials/svg?seed=Neil%20Lawrence&fontWeight=700&radius=16,Artificial Intelligence; Computer Science,University of Cambridge,Chief Scientist,Probabilistic Non-linear Principal Component Analysis with Gaussian Process Latent Variable Models; Gaussian Process Latent Variable Models for Visualisation of High Dimensional Data; Proceedings of the 27th International Conference on Neural Information Processing Systems - Volume 1; Variational Information Distillation for Knowledge Transfer; WiFi-SLAM Using G aussian Process Latent Variable Models
Graham Neubig,Professor at Carnegie Mellon University,https://x.com/gneubig,https://api.dicebear.com/9.x/initials/svg?seed=Graham%20Neubig&fontWeight=700&radius=16,Natural Language Processing; Artificial Intelligence; Computer Science,Carnegie Mellon University,Professor,"Pre-train, Prompt, and Predict: A Systematic Survey of Prompting Methods in Natural Language Processing; A Syntactic Neural Model for General-Purpose Code Generation; A systematic evaluation of large language models of code; TaBERT: Pretraining for Joint Understanding of Textual and Tabular Data"
Doina Precup,Professor at Google (United States),,https://upload.wikimedia.org/wikipedia/commons/thumb/a/a1/Doina_Precup_with_Ian_Kerr.jpg/330px-Doina_Precup_with_Ian_Kerr.jpg,Reinforcement Learning; Computer Science; Artificial Intelligence; Machine Learning,Google (United States),Professor,The Multimodal Brain Tumor Image Segmentation Benchmark (BRATS); Between MDPs and semi-MDPs: A framework for temporal abstraction in reinforcement learning; Deep Reinforcement Learning That Matters; Fast gradient-descent methods for temporal-difference learning with linear function approximation; Eligibility Traces for Off-Policy Policy Evaluation
Zoubin Ghahramani,Computer Scientist at University of Cambridge,https://x.com/ZoubinGhahrama1,https://upload.wikimedia.org/wikipedia/commons/thumb/9/95/Professor_Zoubin_Ghahramani_FRS.jpg/330px-Professor_Zoubin_Ghahramani_FRS.jpg,Artificial Intelligence; Computer Science; Machine Learning,University of Cambridge,Computer Scientist,Dropout as a Bayesian Approximation: Representing Model Uncertainty in\n Deep Learning; An Introduction to Variational Methods for Graphical Models; An Internal Model for Sensorimotor Integration; Semi-supervised learning using Gaussian fields and harmonic functions; Dropout as a Bayesian Approximation: Representing Model Uncertainty in Deep Learning
Ian Goodfellow,Ian J at University of Cambridge,,https://upload.wikimedia.org/wikipedia/commons/thumb/f/fe/Ian_Goodfellow.jpg/330px-Ian_Goodfellow.jpg,Artificial Intelligence; Computer Science; Machine Learning,University of Cambridge,Ian J,Generative adversarial networks; TensorFlow: Large-Scale Machine Learning on Heterogeneous Distributed Systems; Deep Learning; Explaining and Harnessing Adversarial Examples; Intriguing properties of neural networks
Russ Tedrake,Professor at Massachusetts Institute of Technology,,https://api.dicebear.com/9.x/initials/svg?seed=Russ%20Tedrake&fontWeight=700&radius=16,Artificial Intelligence; Computer Science; Robotics,Massachusetts Institute of Technology,Professor,"Efficient Bipedal Robots Based on Passive-Dynamic Walkers; Optimization-based locomotion planning, estimation, and control design for the atlas humanoid robot; A direct method for trajectory optimization of rigid bodies through contact; LQR-trees: Feedback Motion Planning via Sums-of-Squares Verification; Whole-body motion planning with centroidal dynamics and full kinematics"
Kate Crawford,Professor at Microsoft (United States),https://x.com/katecrawford,https://upload.wikimedia.org/wikipedia/commons/thumb/e/e4/Kate_Crawford_in_2025_05.jpg/330px-Kate_Crawford_in_2025_05.jpg,Computer Science,Microsoft (United States),Professor,"CRITICAL QUESTIONS FOR BIG DATA; Seeing without knowing: Limitations of the transparency ideal and its application to algorithmic accountability; Atlas of AI; Atlas of AI: Power, Politics, and the Planetary Costs of Artificial Intelligence; Following you: Disciplines of listening in social media"
Carla Gomes,Professor at Cornell University,,https://upload.wikimedia.org/wikipedia/commons/thumb/3/31/Carla_Gomes_at_FLoC_2006.jpg/330px-Carla_Gomes_at_FLoC_2006.jpg,Artificial Intelligence; Computer Science,Cornell University,Professor,Scientific discovery in the age of artificial intelligence; The eBird enterprise: An integrated approach to development and application of citizen science; Tackling Climate Change with Machine Learning; Boosting combinatorial search through randomization; Algorithm portfolios
Ashish Vaswani,Computer Scientist at Google (United States),https://x.com/ashVaswani,https://api.dicebear.com/9.x/initials/svg?seed=Ashish%20Vaswani&fontWeight=700&radius=16,Natural Language Processing; Artificial Intelligence; Computer Science; Machine Learning,Google (United States),Computer Scientist,"MizAR 60 for Mizar 50; Attention Is All You Need; Relational inductive biases, deep learning, and graph networks; Music Transformer: Generating Music with Long-Term Structure; Self-Attention with Relative Position Representations"
Nicolas Papernot,Professor at University of Toronto,https://x.com/nicolaspapernot,https://api.dicebear.com/9.x/initials/svg?seed=Nicolas%20Papernot&fontWeight=700&radius=16,Artificial Intelligence; Computer Science; Machine Learning,University of Toronto,Professor,The Limitations of Deep Learning in Adversarial Settings; Practical Black-Box Attacks against Machine Learning; Transferability in Machine Learning: from Phenomena to Black-Box Attacks using Adversarial Samples; Ensemble Adversarial Training: Attacks and Defenses; MixMatch: A Holistic Approach to Semi-Supervised Learning
Alex Smola,Computer Scientist at Amazon Web Services,https://x.com/smolix,https://api.dicebear.com/9.x/initials/svg?seed=Alex%20Smola&fontWeight=700&radius=16,Artificial Intelligence; Computer Science; Machine Learning,Amazon Web Services,Computer Scientist,A tutorial on support vector regression; Estimating the Support of a High-Dimensional Distribution; Hierarchical Attention Networks for Document Classification; Support Vector Regression Machines; New Support Vector Algorithms
David Patterson,Computer Scientist at Google (United States),https://x.com/Berkeley_EECS,https://api.dicebear.com/9.x/initials/svg?seed=David%20Patterson&fontWeight=700&radius=16,Computer Science,Google (United States),Computer Scientist,A view of cloud computing; Above the Clouds: A Berkeley View of Cloud Computing; A case for redundant arrays of inexpensive disks (RAID); Computer Organization and Design: the Hardware/Software Interface; LogP: towards a realistic model of parallel computation
Marinka Žitnik,Professor at Purdue University West Lafayette,https://x.com/marinkazitnik,https://api.dicebear.com/9.x/initials/svg?seed=Marinka%20%C5%BDitnik&fontWeight=700&radius=16,Artificial Intelligence; Computer Science; Machine Learning,Purdue University West Lafayette,Professor,"Orange: data mining toolbox in python; Scientific discovery in the age of artificial intelligence; Modeling polypharmacy side effects with graph convolutional networks; GNNExplainer: Generating Explanations for Graph Neural Networks; Machine learning for integrating data in biology and medicine: Principles, practice, and opportunities"
Timothy Lillicrap,Timothy P at Google (United States),,https://api.dicebear.com/9.x/initials/svg?seed=Timothy%20Lillicrap&fontWeight=700&radius=16,Artificial Intelligence; Computer Science; Machine Learning,Google (United States),Timothy P,"Mastering the game of Go with deep neural networks and tree search; Mastering the game of Go without human knowledge; Continuous control with deep reinforcement learning; A general reinforcement learning algorithm that masters chess, shogi, and Go through self-play"
Marc Raibert,Director at Boston Dynamics (United States),,https://upload.wikimedia.org/wikipedia/commons/thumb/b/bc/Marc_Raibert_-_Empowering_the_Future_%28cropped%29.jpg/330px-Marc_Raibert_-_Empowering_the_Future_%28cropped%29.jpg,Artificial Intelligence; Computer Science; Robotics,Boston Dynamics (United States),Director,"Hybrid Position/Force Control of Manipulators; Legged Robots That Balance; BigDog, the Rough-Terrain Quadruped Robot; Experiments in Balance with a 3D One-Legged Hopping Machine; Animation of dynamic legged locomotion"
Jacob Devlin,AI Researcher,,https://api.dicebear.com/9.x/initials/svg?seed=Jacob%20Devlin&fontWeight=700&radius=16,Natural Language Processing; Artificial Intelligence; Computer Science,Google,Researcher,AI-Assisted Pipeline for Dynamic Generation of Trustworthy Health Supplement Content at Scale; PaLM: Scaling Language Modeling with Pathways; Natural Questions: A Benchmark for Question Answering Research; Scaling Instruction-Finetuned Language Models
Vijay Kumar,retired IPS officer at Jamia Hamdard,https://x.com/vijaytupakula,https://upload.wikimedia.org/wikipedia/commons/thumb/5/57/The_DG%2C_CRPF%2C_Shri_K._Vijay_Kumar_addressing_the_recruits_after_reviewing_the_Passing_Out-_cum_-Attestation_Parade_of_664_recruits%2C_at_RTC_%E2%80%93_AVADI%2C_CRPF%2C_in_Chennai_on_August_31%2C_2012_%28cropped%29.jpg/330px-thumbnail.jpg,Artificial Intelligence; Computer Science; Robotics,Jamia Hamdard,retired IPS officer,Minimum snap trajectory generation and control for quadrotors; Modeling and control of formations of nonholonomic mobile robots; A vision-based formation control framework; Trajectory generation and control for precise aggressive maneuvers with quadrotors; Leader-to-Formation Stability
Emma Brunskill,Professor at Stanford University,https://x.com/EmmaBrunskill,https://api.dicebear.com/9.x/initials/svg?seed=Emma%20Brunskill&fontWeight=700&radius=16,Artificial Intelligence; Computer Science; Machine Learning,Stanford University,Professor,On the Opportunities and Risks of Foundation Models; Global and regional hearing impairment prevalence: an analysis of 42 studies in 29 countries; Towards the Systematic Reporting of the Energy and Carbon Footprints of\n Machine Learning; Designing mobile interfaces for novice and low-literacy users; Scaling up behavioral science interventions in online education
Jonas Peters,Professor at ETH Zurich,https://x.com/SusanMurphylab1,https://api.dicebear.com/9.x/initials/svg?seed=Jonas%20Peters&fontWeight=700&radius=16,Artificial Intelligence; Computer Science,ETH Zurich,Professor,"Inferring causation from time series in Earth system sciences; Elements of Causal Inference: Foundations and Learning Algorithms; Nonlinear causal discovery with additive noise models; Comments on the paper Causal inference by using invariant prediction: identification and confidence intervals by Peters, Buhlmann and Meinshausen; Counterfactual reasoning and learning systems: the example of computational advertising"
Jacob Steinhardt,"Professor at University of California, Berkeley",,https://upload.wikimedia.org/wikipedia/commons/1/1f/Jacob_Steinhart.jpg,Artificial Intelligence; Computer Science; Machine Learning,"University of California, Berkeley",Professor,"Agnostic Learning with Unknown Utilities; The Many Faces of Robustness: A Critical Analysis of Out-of-Distribution Generalization; Natural Adversarial Examples; The malicious use of artificial intelligence: Forecasting, prevention, and mitigation; The Malicious Use of Artificial Intelligence: Forecasting, Prevention, and Mitigation"
Aidan Gomez,Computer Scientist at Google (United States),https://x.com/aidangomezzz,https://upload.wikimedia.org/wikipedia/commons/thumb/4/46/Aidan_Gomez_at_%22ALL_IN%22_2025_06.jpg/330px-Aidan_Gomez_at_%22ALL_IN%22_2025_06.jpg,Artificial Intelligence; Computer Science; Machine Learning,Google (United States),Computer Scientist,MizAR 60 for Mizar 50; Attention Is All You Need; Disease variant prediction with deep generative models of evolutionary data; One Model To Learn Them All; Depthwise Separable Convolutions for Neural Machine Translation
Mustafa Suleyman,Founder at Inflection AI,https://x.com/mustafasuleyman,https://upload.wikimedia.org/wikipedia/commons/thumb/2/20/Mustafa_Suleyman_photo_%28cropped%29.jpg/330px-Mustafa_Suleyman_photo_%28cropped%29.jpg,Artificial Intelligence; Computer Science; Deep Learning,Inflection AI,Founder,International evaluation of an AI system for breast cancer screening; The Kinetics Human Action Video Dataset; Clinically applicable deep learning for diagnosis and referral in retinal disease; Key challenges for delivering clinical impact with artificial intelligence; Teaching Machines to Read and Comprehend
Chris Olah,Co-Founder at Google,https://x.com/ch402,https://api.dicebear.com/9.x/initials/svg?seed=Chris%20Olah&fontWeight=700&radius=16,Artificial Intelligence; Computer Science; Machine Learning,Google,Co-Founder,TensorFlow: Large-Scale Machine Learning on Heterogeneous Distributed Systems; Deconvolution and Checkerboard Artifacts; Agnostic Learning with Unknown Utilities; Feature Visualization; The Building Blocks of Interpretability
Amin Vahdat,Computer Scientist at Google (United States),,https://api.dicebear.com/9.x/initials/svg?seed=Amin%20Vahdat&fontWeight=700&radius=16,Computer Science,Google (United States),Computer Scientist,"Epidemic routing for partially-connected ad hoc networks; A scalable, commodity data center network architecture; P4; B4"
Samuel Madden,Computer Scientist at Massachusetts Institute of Technology,,https://api.dicebear.com/9.x/initials/svg?seed=Samuel%20Madden&fontWeight=700&radius=16,Artificial Intelligence; Computer Science,Massachusetts Institute of Technology,Computer Scientist,TAG; TinyDB: an acquisitional query processing system for sensor networks; TinyOS: An Operating System for Sensor Networks; The pothole patrol; A comparison of approaches to large-scale data analysis
Anca Dragan,Professor at Berkeley College,https://x.com/ancadianadragan,https://api.dicebear.com/9.x/initials/svg?seed=Anca%20Dragan&fontWeight=700&radius=16,Artificial Intelligence; Computer Science; Robotics; Machine Learning,Berkeley College,Professor,CHOMP: Covariant Hamiltonian optimization for motion planning; Legibility and predictability of robot motion; Planning for Autonomous Cars that Leverage Effects on Human Actions; A policy-blending formalism for shared control
Hugo Larochelle,AI Researcher,https://x.com/hugo_larochelle,https://api.dicebear.com/9.x/initials/svg?seed=Hugo%20Larochelle&fontWeight=700&radius=16,Artificial Intelligence; Computer Science; Machine Learning,Google Brain,Researcher,Domain-Adversarial Training of Neural Networks; Extracting and composing robust features with denoising autoencoders; Practical Bayesian Optimization of Machine Learning Algorithms; Stacked Denoising Autoencoders: Learning Useful Representations in a Deep Network with a Local Denoising Criterion; Greedy Layer-Wise Training of Deep Networks
Samy Bengio,Computer Scientist at Apple (Israel),,https://upload.wikimedia.org/wikipedia/commons/thumb/1/1a/Samy_Bengio_at_Apple_in_2021.jpg/330px-Samy_Bengio_at_Apple_in_2021.jpg,Artificial Intelligence; Computer Science; Machine Learning,Apple (Israel),Computer Scientist,Show and tell: A neural image caption generator; Understanding deep learning (still) requires rethinking generalization; DeViSE: A Deep Visual-Semantic Embedding Model; Adversarial Examples in the Physical World; Tacotron: Towards End-to-End Speech Synthesis
Luke Zettlemoyer,Computer Scientist at University of Washington,https://x.com/uwcse,https://api.dicebear.com/9.x/initials/svg?seed=Luke%20Zettlemoyer&fontWeight=700&radius=16,Natural Language Processing; Artificial Intelligence; Computer Science,University of Washington,Computer Scientist,"HISTORIAE, History of Socio-Cultural Transformation as Linguistic Data Science. A Humanities Use Case; Deep Contextualized Word Representations; BART: Denoising Sequence-to-Sequence Pre-training for Natural Language Generation, Translation, and Comprehension; Multilingual Denoising Pre-training for Neural Machine Translation; Knowledge-Based Weak Supervision for Information Extraction of Overlapping Relations"
Matei Zaharia,Computer Scientist at Berkeley College,https://x.com/matei_zaharia,https://upload.wikimedia.org/wikipedia/commons/thumb/0/0f/Matei_Zaharia_at_the_2004_ACM-ICPC_World_Finals_in_Prague_%28cropped%29.jpg/330px-Matei_Zaharia_at_the_2004_ACM-ICPC_World_Finals_in_Prague_%28cropped%29.jpg,Artificial Intelligence; Computer Science,Berkeley College,Computer Scientist,A view of cloud computing; Above the Clouds: A Berkeley View of Cloud Computing; Spark: cluster computing with working sets; Resilient distributed datasets: a fault-tolerant abstraction for in-memory cluster computing; Apache Spark
Emily M Bender,Professor at University of Washington,,https://upload.wikimedia.org/wikipedia/commons/thumb/6/61/Emily_M_Bender_CHM_Mountain_View_March_2025.jpg/330px-Emily_M_Bender_CHM_Mountain_View_March_2025.jpg,Natural Language Processing; Artificial Intelligence; Computer Science,University of Washington,Professor,"On the Dangers of Stochastic Parrots; Introduction/motivation; Climbing towards NLU: On Meaning, Form, and Understanding in the Age of Data; Data Statements for Natural Language Processing: Toward Mitigating System Bias and Enabling Better Science; Data and its (dis)contents: A survey of dataset development and use in\n machine learning research"
Jacob Andreas,Professor at Massachusetts Institute of Technology,https://x.com/jacobandreas,https://api.dicebear.com/9.x/initials/svg?seed=Jacob%20Andreas&fontWeight=700&radius=16,Natural Language Processing; Artificial Intelligence; Computer Science,Massachusetts Institute of Technology,Professor,Learning to Reason: End-to-End Module Networks for Visual Question Answering; Learning to Compose Neural Networks for Question Answering; Modeling Relationships in Referential Expressions with Compositional Modular Networks; Speaker-Follower Models for Vision-and-Language Navigation; Modular Multitask Reinforcement Learning with Policy Sketches
Dina Katabi,Computer Scientist at Massachusetts Institute of Technology,,https://upload.wikimedia.org/wikipedia/commons/thumb/a/a9/Dina_Katabi.png/330px-Dina_Katabi.png,Artificial Intelligence; Computer Science,Massachusetts Institute of Technology,Computer Scientist,XORs in the Air: Practical Wireless Network Coding; Embracing wireless interference; Trading structure for randomness in wireless opportunistic routing; Congestion control for high bandwidth-delay product networks; Smart Homes that Monitor Breathing and Heart Rate
Sergey Ioffe,AI Researcher,,https://api.dicebear.com/9.x/initials/svg?seed=Sergey%20Ioffe&fontWeight=700&radius=16,Artificial Intelligence; Computer Science; Machine Learning,Google (United States),Researcher,"Rethinking the Inception Architecture for Computer Vision; Batch Normalization: Accelerating Deep Network Training by Reducing Internal Covariate Shift; Inception-v4, Inception-ResNet and the Impact of Residual Connections on Learning; No Fuss Distance Metric Learning Using Proxies"
Regina Barzilay,Computer Scientist at Jambi University,https://x.com/wix,https://api.dicebear.com/9.x/initials/svg?seed=Regina%20Barzilay&fontWeight=700&radius=16,Natural Language Processing; Artificial Intelligence; Computer Science; Machine Learning,Jambi University,Computer Scientist,A Deep Learning Approach to Antibiotic Discovery; Analyzing Learned Molecular Representations for Property Prediction; De novo design of protein structure and function with RFdiffusion; Using lexical chains for text summarization; Prediction of Organic Reaction Outcomes Using Machine Learning
Honglak Lee,AI Researcher,,https://api.dicebear.com/9.x/initials/svg?seed=Honglak%20Lee&fontWeight=700&radius=16,Artificial Intelligence; Computer Science; Machine Learning,Seoul National University,Researcher,An analysis of single-layer networks in unsupervised feature learning; Convolutional deep belief networks for scalable unsupervised learning of hierarchical representations; Efficient sparse coding algorithms; Multimodal Deep Learning; Learning structured output representation using deep conditional generative models
Stuart Russell,Computer Scientist at Berkeley College,https://x.com/stuartrussell71,https://upload.wikimedia.org/wikipedia/commons/thumb/4/40/Stuart_Russell_01.jpg/330px-Stuart_Russell_01.jpg,Artificial Intelligence; Computer Science; Machine Learning,Berkeley College,Computer Scientist,"Artificial intelligence: a modern approach; Distance Metric Learning with Application to Clustering with Side-Information; Dynamic bayesian networks: representation, inference and learning; Artificial Intelligence: A Modern Approach; Policy Invariance Under Reward Transformations: Theory and Application to Reward Shaping"
Jianfeng Gao,AI Researcher,,https://api.dicebear.com/9.x/initials/svg?seed=Jianfeng%20Gao&fontWeight=700&radius=16,Natural Language Processing; Artificial Intelligence; Computer Science; Machine Learning,Microsoft (United States),Researcher,Embedding Entities and Relations for Learning and Inference in Knowledge Bases; A Diversity-Promoting Objective Function for Neural Conversation Models; Domain-Specific Language Model Pretraining for Biomedical Natural Language Processing; Deep Learning--based Text Classification; Analysis of Points of Interests Recommended for Leisure Walk Descriptions
Mirella Lapata,Computer Scientist at Language Science (South Korea),,https://api.dicebear.com/9.x/initials/svg?seed=Mirella%20Lapata&fontWeight=700&radius=16,Natural Language Processing; Artificial Intelligence; Computer Science,Language Science (South Korea),Computer Scientist,"Text Summarization with Pretrained Encoders; Don’t Give Me the Details, Just the Summary! Topic-Aware Convolutional Neural Networks for Extreme Summarization; Long Short-Term Memory-Networks for Machine Reading; Composition in Distributional Models of Semantics; Proceedings of the 2025 Conference on Empirical Methods in Natural Language Processing"
Andrej Karpathy,Computer Scientist at OpenAI,https://x.com/karpathy,https://upload.wikimedia.org/wikipedia/commons/thumb/c/c0/Andrej_Karpathy%2C_OpenAI.png/330px-Andrej_Karpathy%2C_OpenAI.png,Natural Language Processing; Artificial Intelligence; Computer Science,OpenAI,Computer Scientist,ImageNet Large Scale Visual Recognition Challenge; Large-Scale Video Classification with Convolutional Neural Networks; Deep visual-semantic alignments for generating image descriptions; Large-scale Video Classiﬁcation with Convolutional Neural Networks; DenseCap: Fully Convolutional Localization Networks for Dense Captioning
Kyunghyun Cho,Computer Scientist at Canadian Institute for Advanced Research,https://x.com/kchonyc,https://upload.wikimedia.org/wikipedia/commons/thumb/0/07/SD_2025_-_Kyunghyun_Cho_02_%28cropped%29.jpg/330px-SD_2025_-_Kyunghyun_Cho_02_%28cropped%29.jpg,Natural Language Processing; Artificial Intelligence; Computer Science; Machine Learning,Canadian Institute for Advanced Research,Computer Scientist,"Show, Attend and Tell: Neural Image Caption Generation with Visual Attention; On the Properties of Neural Machine Translation: Encoder–Decoder Approaches; Attention-Based Models for Speech Recognition; Show, Attend and Tell: Neural Image Caption Generation with Visual\n Attention; On the Properties of Neural Machine Translation: Encoder-Decoder Approaches"
Isabelle Guyon,Computer Scientist at Gleason (United States),,https://upload.wikimedia.org/wikipedia/commons/thumb/c/c2/SD_2025_-_Isabelle_Guyon_02_%28cropped%29.jpg/330px-SD_2025_-_Isabelle_Guyon_02_%28cropped%29.jpg,Artificial Intelligence; Computer Science; Machine Learning,Gleason (United States),Computer Scientist,A training algorithm for optimal margin classifiers; Gene Selection for Cancer Classification using Support Vector Machines; SIGNATURE VERIFICATION USING A “SIAMESE” TIME DELAY NEURAL NETWORK; Feature extraction : foundations and applications; Comparison of classifier methods: a case study in handwritten digit recognition
Nando de Freitas,Computer Scientist at Google DeepMind,https://x.com/NandoDF,https://api.dicebear.com/9.x/initials/svg?seed=Nando%20de%20Freitas&fontWeight=700&radius=16,Artificial Intelligence; Computer Science; Machine Learning,Google DeepMind,Computer Scientist,"Sequential Monte Carlo Methods in Practice; Taking the Human Out of the Loop: A Review of Bayesian Optimization; An Introduction to MCMC for Machine Learning; A Tutorial on Bayesian Optimization of Expensive Cost Functions, with Application to Active User Modeling and Hierarchical Reinforcement Learning; Dueling Network Architectures for Deep Reinforcement Learning"
