Name,Description,X,Avatar,Topics,Works at,Role,Papers
Mark Chen,Taiwanese politician and atmospheric scientist who served as... at OpenAI,https://x.com/MarkChenNext,https://upload.wikimedia.org/wikipedia/commons/thumb/1/14/%E9%99%B3%E5%94%90%E5%B1%B1_2025.jpg/330px-%E9%99%B3%E5%94%90%E5%B1%B1_2025.jpg,Computer Science,OpenAI,Taiwanese politician and atmospheric scientist who served as...,Language Models are Few-Shot Learners; Automaticity of social behavior: Direct effects of trait construct and stereotype activation on action.; Hierarchical Text-Conditional Image Generation with CLIP Latents; Epidemiologic Features and Clinical Course of Patients Infected With SARS-CoV-2 in Singapore
Philipp Koehn,Computer Scientist at Johns Hopkins University,,https://api.dicebear.com/9.x/initials/svg?seed=Philipp%20Koehn&fontWeight=700&radius=16,Natural Language Processing; Artificial Intelligence; Computer Science,Johns Hopkins University,Computer Scientist,Moses; Statistical phrase-based translation; Statistical Significance Tests for Machine Translation Evaluation.; Moses: Open Source Toolkit for Statistical Machine Translation; Abstract Meaning Representation for Sembanking
Surya Ganguli,Professor at Stanford University,https://x.com/SuryaGanguli,https://api.dicebear.com/9.x/initials/svg?seed=Surya%20Ganguli&fontWeight=700&radius=16,Artificial Intelligence; Computer Science; Machine Learning,Stanford University,Professor,An analytic theory of creativity in convolutional diffusion models; Reshaping Global Loop Structure to Accelerate Local Optimization by Smoothing Rugged Landscapes; Contrastive Concept-Tree Search for LLM-Assisted Algorithm Discovery; From Kepler to Newton: Inductive Biases Guide Learned World Models in Transformers; Gaussian Process Inference Reveals Non-separability of Position and Velocity Tuning in Grid Cells
Thomas G Dietterich,Thomas G at Oregon State University,,https://upload.wikimedia.org/wikipedia/commons/thumb/7/7b/Thomas_Dietterich.jpg/330px-Thomas_Dietterich.jpg,Artificial Intelligence; Computer Science; Machine Learning,Oregon State University,Thomas G,"Ensemble Methods in Machine Learning; Approximate Statistical Tests for Comparing Supervised Classification Learning Algorithms; An Experimental Comparison of Three Methods for Constructing Ensembles of Decision Trees: Bagging, Boosting, and Randomization; Solving the multiple instance problem with axis-parallel rectangles; Proceedings of the 13th International Conference on Neural Information Processing Systems"
Yejin Choi,Computer Scientist at Seoul National University,https://x.com/YejinChoinka,https://upload.wikimedia.org/wikipedia/commons/thumb/a/ad/Yejin_Choi_%C2%A9_John_D._and_Catherine_T._MacArthur_Foundation%E2%80%93used_with_permission.jpg/330px-Yejin_Choi_%C2%A9_John_D._and_Catherine_T._MacArthur_Foundation%E2%80%93used_with_permission.jpg,Natural Language Processing; Artificial Intelligence; Computer Science,Seoul National University,Computer Scientist,Oscar: Object-Semantics Aligned Pre-training for Vision-Language Tasks; The Curious Case of Neural Text Degeneration; BabyTalk: Understanding and Generating Simple Image Descriptions; Truth of Varying Shades: Analyzing Language in Fake News and Political Fact-Checking; VinVL: Revisiting Visual Representations in Vision-Language Models
Olga Russakovsky,Computer Scientist at Princeton University,,https://api.dicebear.com/9.x/initials/svg?seed=Olga%20Russakovsky&fontWeight=700&radius=16,Artificial Intelligence; Computer Science; Machine Learning,Princeton University,Computer Scientist,ImageNet Large Scale Visual Recognition Challenge; What’s the Point: Semantic Segmentation with Point Supervision; End-to-End Learning of Action Detection from Frame Glimpses in Videos; Art and the science of generative AI; Every Moment Counts: Dense Detailed Labeling of Actions in Complex Videos
Kevin Knight,American professional wrestler at Google,,https://upload.wikimedia.org/wikipedia/commons/thumb/2/23/Kevin_Knight_at_AEW_Dynamite_-_August_27_2025_%28cropped%29.jpg/330px-Kevin_Knight_at_AEW_Dynamite_-_August_27_2025_%28cropped%29.jpg,Natural Language Processing; Artificial Intelligence; Computer Science,Google,American professional wrestler,Abstract Meaning Representation for Sembanking; Prevalence and outcomes of anemia in cancer: a systematic review of the literature; A syntax-based statistical translation model; Summarization beyond sentence extraction: A probabilistic approach to sentence compression; Machine transliteration
Shafi Goldwasser,Computer Scientist at Berkeley College,,https://upload.wikimedia.org/wikipedia/commons/thumb/8/84/Shafi_Goldwasser.JPG/330px-Shafi_Goldwasser.JPG,Theoretical Computer Science; Computer Science,Berkeley College,Computer Scientist,The Knowledge Complexity of Interactive Proof Systems; A Digital Signature Scheme Secure Against Adaptive Chosen-Message Attacks; Probabilistic encryption; How to construct random functions; Probabilistic encryption &amp; how to play mental poker keeping secret all partial information
Dieter Fox,Professor at Nvidia (United States),,https://upload.wikimedia.org/wikipedia/commons/thumb/c/cc/Dieter_Fox_University_of_Washington_associate_professor_of_computer_science_and_engineering.jpg/330px-Dieter_Fox_University_of_Washington_associate_professor_of_computer_science_and_engineering.jpg,Artificial Intelligence; Computer Science; Machine Learning; Robotics; Computer Vision,Nvidia (United States),Professor,Learning from Unscripted Deictic Gesture and Language for Human-Robot Interactions; A spatio-temporal probabilistic model for multi-sensor object recognition; MegaPose: 6D Pose Estimation of Novel Objects via Render & Compare; GR00T N1: An Open Foundation Model for Generalist Humanoid Robots; 3D-MVP: 3D Multiview Pretraining for Manipulation
Danqi Chen,Computer Scientist at Princeton University,https://x.com/danqi_chen,https://upload.wikimedia.org/wikipedia/commons/thumb/9/97/ICLR_2025_-_Danqi_Chen_01.jpg/330px-ICLR_2025_-_Danqi_Chen_01.jpg,Natural Language Processing; Artificial Intelligence; Computer Science,Princeton University,Computer Scientist,"HISTORIAE, History of Socio-Cultural Transformation as Linguistic Data Science. A Humanities Use Case; SimCSE: Simple Contrastive Learning of Sentence Embeddings; A Fast and Accurate Dependency Parser using Neural Networks; Reasoning With Neural Tensor Networks for Knowledge Base Completion; Reading Wikipedia to Answer Open-Domain Questions"
Bo Li,Chinese poet acclaimed as one of the best and most important... at University of Illinois Urbana-Champaign,,https://upload.wikimedia.org/wikipedia/commons/thumb/4/4c/LiBai.jpg/330px-LiBai.jpg,Computer Science,University of Illinois Urbana-Champaign,Chinese poet acclaimed as one of the best and most important...,RSEM: accurate transcript quantification from RNA-Seq data with or without a reference genome; De novo transcript sequence reconstruction from RNA-seq using the Trinity platform for reference generation and analysis; Whole-genome analyses resolve early branches in the tree of life of modern birds; RNA-Seq gene expression estimation with read mapping uncertainty; Resistance to checkpoint blockade therapy through inactivation of antigen presentation
Razvan Pascanu,Computer Scientist at Google DeepMind,https://x.com/rpascanu,https://api.dicebear.com/9.x/initials/svg?seed=Razvan%20Pascanu&fontWeight=700&radius=16,Artificial Intelligence; Computer Science; Machine Learning; Artificial Neural Networks,Google DeepMind,Computer Scientist,"Overcoming catastrophic forgetting in neural networks; On the difficulty of training Recurrent Neural Networks; Relational inductive biases, deep learning, and graph networks; Progressive Neural Networks; Theano: A CPU and GPU Math Compiler in Python"
Vitaly Shmatikov,Computer Scientist at Cornell University,,https://api.dicebear.com/9.x/initials/svg?seed=Vitaly%20Shmatikov&fontWeight=700&radius=16,Artificial Intelligence; Computer Science,Cornell University,Computer Scientist,Membership Inference Attacks Against Machine Learning Models; Robust De-anonymization of Large Sparse Datasets; Privacy-Preserving Deep Learning; De-anonymizing Social Networks; How To Backdoor Federated Learning
Omer Levy,AI Researcher,,https://api.dicebear.com/9.x/initials/svg?seed=Omer%20Levy&fontWeight=700&radius=16,Natural Language Processing; Artificial Intelligence; Computer Science,Itamar Medical (Israel),Researcher,"HISTORIAE, History of Socio-Cultural Transformation as Linguistic Data Science. A Humanities Use Case; GLUE: A Multi-Task Benchmark and Analysis Platform for Natural Language Understanding; Neural Word Embedding as Implicit Matrix Factorization; Improving Distributional Similarity with Lessons Learned from Word Embeddings"
Kenton Lee,AI Researcher,,https://api.dicebear.com/9.x/initials/svg?seed=Kenton%20Lee&fontWeight=700&radius=16,Natural Language Processing; Artificial Intelligence; Computer Science,Korea University,Researcher,Natural Questions: A Benchmark for Question Answering Research; Deep Contextualized Word Representations; REALM: Retrieval-Augmented Language Model Pre-Training; Deep Semantic Role Labeling: What Works and What’s Next
John Schulman,Computer Scientist at OpenAI,,https://api.dicebear.com/9.x/initials/svg?seed=John%20Schulman&fontWeight=700&radius=16,Reinforcement Learning; Computer Science; Artificial Intelligence; Machine Learning,OpenAI,Computer Scientist,Diagnosing Non-Intermittent Anomalies in Reinforcement Learning Policy Executions (Short Paper); Trust Region Policy Optimization; InfoGAN: Interpretable Representation Learning by Information Maximizing\n Generative Adversarial Nets; High-Dimensional Continuous Control Using Generalized Advantage Estimation; InfoGAN: Interpretable Representation Learning by Information Maximizing Generative Adversarial Nets
Jeff Dean,Computer Scientist at Google (United States),https://x.com/jeffdean,https://upload.wikimedia.org/wikipedia/commons/thumb/1/1f/Jeff_Dean_in_2025_x.jpg/330px-Jeff_Dean_in_2025_x.jpg,Artificial Intelligence; Computer Science; Deep Learning; Machine Learning,Google (United States),Computer Scientist,Distributed Representations of Words and Phrases and their Compositionality; A guide to deep learning in healthcare; PaLM: Scaling Language Modeling with Pathways; DeViSE: A Deep Visual-Semantic Embedding Model; Efficient Neural Architecture Search via Parameters Sharing
Sergey Brin,Computer Scientist at Alphabet Inc.,https://x.com/sergeybrinn,https://upload.wikimedia.org/wikipedia/commons/thumb/d/d3/Sergey_Brin_Ted_2010_%28cropped%29.jpg/330px-Sergey_Brin_Ted_2010_%28cropped%29.jpg,Artificial Intelligence; Computer Science,Alphabet Inc.,Computer Scientist,The anatomy of a large-scale hypertextual Web search engine; The PageRank Citation Ranking : Bringing Order to the Web; Dynamic itemset counting and implication rules for market basket data; Beyond market baskets; Extracting Patterns and Relations from the World Wide Web
Cynthia Rudin,Computer Scientist at Johns Hopkins University,https://x.com/CynthiaRudin,https://upload.wikimedia.org/wikipedia/commons/thumb/1/1a/Cynthia_Rudin_JSM_2020.png/330px-Cynthia_Rudin_JSM_2020.png,Artificial Intelligence; Computer Science; Machine Learning,Johns Hopkins University,Computer Scientist,"Stop explaining black box machine learning models for high stakes decisions and use interpretable models instead; All Models are Wrong, but Many are Useful: Learning a Variable's Importance by Studying an Entire Class of Prediction Models Simultaneously; Interpretable machine learning: Fundamental principles and 10 grand challenges; Interpretable classifiers using rules and Bayesian analysis: Building a better stroke prediction model; This Looks Like That: Deep Learning for Interpretable Image Recognition"
Christopher Ré,Computer Scientist at Stanford University,https://x.com/HazyResearch,https://upload.wikimedia.org/wikipedia/commons/thumb/3/3c/160906-N-PO203-244_%2829394494722%29.jpg/330px-160906-N-PO203-244_%2829394494722%29.jpg,Artificial Intelligence; Computer Science; Machine Learning,Stanford University,Computer Scientist,On the Opportunities and Risks of Foundation Models; HOGWILD!: A Lock-Free Approach to Parallelizing Stochastic Gradient Descent; Hogwild: A Lock-Free Approach to Parallelizing Stochastic Gradient Descent; Snorkel; Efficiently Modeling Long Sequences with Structured State Spaces
Pranav Rajpurkar,AI Researcher,,https://api.dicebear.com/9.x/initials/svg?seed=Pranav%20Rajpurkar&fontWeight=700&radius=16,Artificial Intelligence; Computer Science; Machine Learning,Harvard University,Researcher,"SQuAD: 100,000+ Questions for Machine Comprehension of Text; Cardiologist-level arrhythmia detection and classification in ambulatory electrocardiograms using a deep neural network; AI in health and medicine; Know What You Don’t Know: Unanswerable Questions for SQuAD; CheXNet: Radiologist-Level Pneumonia Detection on Chest X-Rays with Deep\n Learning"
Marc'Aurelio Ranzato,Computer Scientist at National Institutes of Health,https://x.com/MarcRanzato,https://api.dicebear.com/9.x/initials/svg?seed=Marc%27Aurelio%20Ranzato&fontWeight=700&radius=16,Artificial Intelligence; Computer Science; Machine Learning,National Institutes of Health,Computer Scientist,DeepFace: Closing the Gap to Human-Level Performance in Face Verification; Large Scale Distributed Deep Networks; DeViSE: A Deep Visual-Semantic Embedding Model; Unsupervised Learning of Invariant Feature Hierarchies with Applications to Object Recognition; Efficient Learning of Sparse Representations with an Energy-Based Model
Wojciech Zaremba,Computer Scientist at OpenAI,,https://api.dicebear.com/9.x/initials/svg?seed=Wojciech%20Zaremba&fontWeight=700&radius=16,Artificial Intelligence; Computer Science; Machine Learning; Artificial Neural Networks,OpenAI,Computer Scientist,Intriguing properties of neural networks; Spectral Networks and Locally Connected Networks on Graphs; Domain randomization for transferring deep neural networks from simulation to the real world; Recurrent Neural Network Regularization; Learning dexterous in-hand manipulation
Anima Anandkumar,Computer Scientist at California Institute of Technology,https://x.com/animaanandkumar,https://upload.wikimedia.org/wikipedia/commons/thumb/e/e3/Anima_Anandkumar_speaking_at_AAAS_2026.jpg/330px-Anima_Anandkumar_speaking_at_AAAS_2026.jpg,Artificial Intelligence; Computer Science,California Institute of Technology,Computer Scientist,SegFormer: Simple and Efficient Design for Semantic Segmentation with\n Transformers; Scientific discovery in the age of artificial intelligence; Fourier Neural Operator for Parametric Partial Differential Equations; SegFormer: Simple and Efficient Design for Semantic Segmentation with Transformers; Physics-informed machine learning: case studies for weather and climate modelling
Peter Norvig,Computer Scientist at Google (United States),,https://upload.wikimedia.org/wikipedia/commons/thumb/f/f0/Peter_Norvig_in_2019_%28cropped%29.jpg/330px-Peter_Norvig_in_2019_%28cropped%29.jpg,Artificial Intelligence; Computer Science,Google (United States),Computer Scientist,Artificial intelligence: a modern approach; Quantitative Analysis of Culture Using Millions of Digitized Books; The Unreasonable Effectiveness of Data; Artificial Intelligence: A Modern Approach; Inteligencia artificial: un enfoque moderno
Mohit Bansal,AI Researcher,https://x.com/mhtbansal11,https://api.dicebear.com/9.x/initials/svg?seed=Mohit%20Bansal&fontWeight=700&radius=16,Natural Language Processing; Artificial Intelligence; Computer Science; Machine Learning,University of North Carolina at Chapel Hill,Researcher,LXMERT: Learning Cross-Modality Encoder Representations from Transformers; End-to-End Relation Extraction using LSTMs on Sequences and Tree Structures; MAttNet: Modular Attention Network for Referring Expression Comprehension; Fast Abstractive Summarization with Reinforce-Selected Sentence Rewriting; Adversarial NLI: A New Benchmark for Natural Language Understanding
Joseph Gonzalez,American composer based in Los Angeles at Complexo Hospitalario Universitario A Coruña,https://x.com/JosephGlz99,https://api.dicebear.com/9.x/initials/svg?seed=Joseph%20Gonzalez&fontWeight=700&radius=16,Artificial Intelligence; Computer Science; Machine Learning,Complexo Hospitalario Universitario A Coruña,American composer based in Los Angeles,Apache Spark; Distributed GraphLab; PowerGraph: distributed graph-parallel computation on natural graphs; Efficient Memory Management for Large Language Model Serving with PagedAttention; Tune: A Research Platform for Distributed Model Selection and Training
Yoav Goldberg,Computer Scientist at Bar-Ilan University,,https://api.dicebear.com/9.x/initials/svg?seed=Yoav%20Goldberg&fontWeight=700&radius=16,Natural Language Processing; Artificial Intelligence; Computer Science,Bar-Ilan University,Computer Scientist,Neural Word Embedding as Implicit Matrix Factorization; Improving Distributional Similarity with Lessons Learned from Word Embeddings; word2vec Explained: deriving Mikolov et al.'s negative-sampling word-embedding method; Dependency-Based Word Embeddings; Universal Dependencies v1: A Multilingual Treebank Collection
Jennifer Chayes,"Computer Scientist at University of California, Berkeley",,https://upload.wikimedia.org/wikipedia/commons/thumb/9/9f/Jennifer_Tour_Chayes_vid_02.png/330px-Jennifer_Tour_Chayes_vid_02.png,Computer Science,"University of California, Berkeley",Computer Scientist,"Tackling Climate Change with Machine Learning; Finite-Size Scaling and Correlation Lengths for Disordered Systems; Maximizing Social Influence in Nearly Optimal Time; Convergent sequences of dense graphs I: Subgraph frequencies, metric properties and testing; ChatGPT Chemistry Assistant for Text Mining and the Prediction of MOF Synthesis"
Jeff Clune,Computer Scientist at University of Wyoming,https://x.com/jeffclune,https://api.dicebear.com/9.x/initials/svg?seed=Jeff%20Clune&fontWeight=700&radius=16,Artificial Intelligence; Computer Science; Machine Learning; Artificial Neural Networks,University of Wyoming,Computer Scientist,"How transferable are features in deep neural networks?; Deep neural networks are easily fooled: High confidence predictions for unrecognizable images; Understanding Neural Networks Through Deep Visualization; Automatically identifying, counting, and describing wild animals in camera-trap images with deep learning; Robots that can adapt like animals"
Aäron van den Oord,Computer Scientist at Google DeepMind,https://x.com/avdnoord,https://api.dicebear.com/9.x/initials/svg?seed=A%C3%A4ron%20van%20den%20Oord&fontWeight=700&radius=16,Artificial Intelligence; Computer Science; Machine Learning,Google DeepMind,Computer Scientist,Representation Learning with Contrastive Predictive Coding; WaveNet: A Generative Model for Raw Audio; Neural Discrete Representation Learning.
Ken Goldberg,Computer Scientist at Berkeley College,https://x.com/Ken_Goldberg,https://upload.wikimedia.org/wikipedia/commons/thumb/0/06/Ken-Goldberg-Apr-2019-med-res.jpg/330px-Ken-Goldberg-Apr-2019-med-res.jpg,Computer Vision; Artificial Intelligence; Computer Science; Robotics,Berkeley College,Computer Scientist,Dex-Net 2.0: Deep Learning to Plan Robust Grasps with Synthetic Point Clouds and Analytic Grasp Metrics; Deep Imitation Learning for Complex Manipulation Tasks from Virtual Reality Teleoperation; Learning ambidextrous robot grasping policies; Combating COVID-19—The role of robotics in managing public health and infectious diseases; Dex-Net 1.0: A cloud-based network of 3D objects for robust grasp planning using a Multi-Armed Bandit model with correlated rewards
Lucas Beyer,Computer Scientist at Meta Superintelligence Labs,https://x.com/giffmana,https://api.dicebear.com/9.x/initials/svg?seed=Lucas%20Beyer&fontWeight=700&radius=16,Computer Vision; Artificial Intelligence; Computer Science; Machine Learning,Meta Superintelligence Labs,Computer Scientist,An Image is Worth 16x16 Words: Transformers for Image Recognition at Scale; In Defense of the Triplet Loss for Person Re-Identification; MLP-Mixer: An all-MLP Architecture for Vision; Scaling Vision Transformers; Revisiting Self-Supervised Visual Representation Learning
Barbara Engelhardt,Computer Scientist at Gladstone Institutes,,https://api.dicebear.com/9.x/initials/svg?seed=Barbara%20Engelhardt&fontWeight=700&radius=16,Artificial Intelligence; Computer Science,Gladstone Institutes,Computer Scientist,The GTEx Consortium atlas of genetic regulatory effects across human tissues; Genetic effects on gene expression across human tissues; Understanding mechanisms underlying human gene expression variation with RNA sequencing; Exploring the phenotypic consequences of tissue specific gene expression variation inferred from GWAS summary statistics; The impact of sex on gene expression across human tissues
Geoffrey Irving,Computer Scientist at OpenAI,https://x.com/geoffreyirving,https://api.dicebear.com/9.x/initials/svg?seed=Geoffrey%20Irving&fontWeight=700&radius=16,Artificial Intelligence; Computer Science,OpenAI,Computer Scientist,TensorFlow: Large-Scale Machine Learning on Heterogeneous Distributed Systems; TensorFlow: A system for large-scale machine learning; TensorFlow: a system for large-scale machine learning; Taxonomy of Risks posed by Language Models; Fine-Tuning Language Models from Human Preferences
Nicholas Carlini,American researcher affiliated with Anthropic and previously... at Google DeepMind,,https://upload.wikimedia.org/wikipedia/commons/thumb/2/23/Nicholas_Carlini_AIME_presentation.jpg/330px-Nicholas_Carlini_AIME_presentation.jpg,Artificial Intelligence; Computer Science; Machine Learning,Google DeepMind,American researcher affiliated with Anthropic and previously...,FixMatch: Simplifying Semi-Supervised Learning with Consistency and Confidence; Adversarial Examples Are Not Easily Detected; Obfuscated Gradients Give a False Sense of Security: Circumventing\n Defenses to Adversarial Examples; Obfuscated Gradients Give a False Sense of Security: Circumventing Defenses to Adversarial Examples; Towards Evaluating the Robustness of Neural Networks
Raia Hadsell,Computer Scientist,https://x.com/RaiaHadsell,https://api.dicebear.com/9.x/initials/svg?seed=Raia%20Hadsell&fontWeight=700&radius=16,Reinforcement Learning; Artificial Intelligence; Computer Science; Machine Learning; Robotics,Independent,Computer Scientist,"Overcoming catastrophic forgetting in neural networks; Dimensionality Reduction by Learning an Invariant Mapping; Learning a Similarity Metric Discriminatively, with Application to Face Verification; Progressive Neural Networks; Skilful precipitation nowcasting using deep generative models of radar"
Alec Radford,Computer Scientist at OpenAI,https://x.com/AlecRad,https://api.dicebear.com/9.x/initials/svg?seed=Alec%20Radford&fontWeight=700&radius=16,Artificial Intelligence; Computer Science; Machine Learning,OpenAI,Computer Scientist,Unsupervised Representation Learning with Deep Convolutional Generative\n Adversarial Networks; Unsupervised Representation Learning with Deep Convolutional Generative Adversarial Networks; Learning Transferable Visual Models From Natural Language Supervision; Language Models are Few-Shot Learners; Scaling Laws for Neural Language Models
Boaz Barak,Computer Scientist at Tel Aviv University,,https://api.dicebear.com/9.x/initials/svg?seed=Boaz%20Barak&fontWeight=700&radius=16,Theoretical Computer Science; Computer Science,Tel Aviv University,Computer Scientist,Computational Complexity: A Modern Approach; Computational Complexity; On the (Im)possibility of Obfuscating Programs; On the (im)possibility of obfuscating programs; Computational Complexity: ADVANCED TOPICS
Dario Amodei,American artificial intelligence researcher and entrepreneur at Anthropic,,https://upload.wikimedia.org/wikipedia/commons/thumb/d/da/Dario_Amodei_at_TechCrunch_Disrupt_2023_01.jpg/330px-Dario_Amodei_at_TechCrunch_Disrupt_2023_01.jpg,Artificial Intelligence; Computer Science,Anthropic,American artificial intelligence researcher and entrepreneur,A cross-platform toolkit for mass spectrometry and proteomics; Language Models are Few-Shot Learners; Deep Speech 2: End-to-End Speech Recognition in English and Mandarin; Scaling Laws for Neural Language Models; Evaluating Large Language Models Trained on Code
Dan Hendrycks,American machine learning researcher at Arizona State University,https://x.com/danhendrycks,https://upload.wikimedia.org/wikipedia/commons/thumb/a/a3/Dan_Hendrycks_2025_%28cropped%29.jpg/330px-Dan_Hendrycks_2025_%28cropped%29.jpg,Artificial Intelligence; Computer Science; Machine Learning,Arizona State University,American machine learning researcher,Gaussian Error Linear Units (GELUs); A Baseline for Detecting Misclassified and Out-of-Distribution Examples in Neural Networks; The Many Faces of Robustness: A Critical Analysis of Out-of-Distribution Generalization; Benchmarking Neural Network Robustness to Common Corruptions and\n Perturbations; Bridging Nonlinearities and Stochastic Regularizers with Gaussian Error Linear Units
Joan Bruna,AI Researcher,https://x.com/UCBStatistics,https://api.dicebear.com/9.x/initials/svg?seed=Joan%20Bruna&fontWeight=700&radius=16,Artificial Neural Networks; Computer Science; Artificial Intelligence,Courant Institute of Mathematical Sciences,Researcher,Intriguing properties of neural networks; Geometric Deep Learning: Going beyond Euclidean data; Spectral Networks and Locally Connected Networks on Graphs; Invariant Scattering Convolution Networks; Deep Convolutional Networks on Graph-Structured Data
