ID,Name,Description,Web URL,Avatar,Topics,Organization,Organization ID,Organization Website,License,Language,Category,Maintained,First Release,Latest Version,Latest Release Date,Repo Pushed At
proj_voxelmorph_voxelmorph,voxelmorph,Unsupervised Learning for Image Registration,https://github.com/voxelmorph/voxelmorph,https://avatars.githubusercontent.com/u/38796681?u=4c10411982a3ef9a67ec54a6adcc1e7292d57568&v=4,,Voxelmorph,org_voxelmorph,http://voxelmorph.mit.edu/,Apache-2.0,Python,library,Yes,2018-05-14T16:19:41Z,v0.3,,2026-02-14T02:47:14Z
proj_autodistill_autodistill,autodistill,Images to inference with no labeling (use foundation models to train supervised models).,https://github.com/autodistill/autodistill,https://avatars.githubusercontent.com/u/132497817?v=4,,Autodistill,org_autodistill,https://autodistill.com/,Apache-2.0,Python,library,Yes,2023-06-06T20:16:41Z,v0.1.2,2023-06-09T17:10:10Z,2025-05-14T07:53:55Z
proj_secretflow_secretflow,secretflow,A unified framework for privacy-preserving data analysis and machine learning,https://github.com/secretflow/secretflow,https://avatars.githubusercontent.com/u/103737651?v=4,,SecretFlow,org_secretflow,https://www.secretflow.org.cn/,Apache-2.0,Python,library,Yes,2022-04-15T09:07:44Z,v0.7.11b3,2022-11-29T07:30:08Z,2025-11-13T06:50:14Z
proj_ambersahdev_open_interface,Open-Interface,Control Any Computer Using LLMs.,https://github.com/AmberSahdev/Open-Interface,https://avatars.githubusercontent.com/u/23853621?u=3ae45f893049a325789523465615c2275013ad20&v=4,,Amber Sahdev,org_amber_sahdev,https://ambersah.dev/,GPL-3.0,Python,library,Yes,2024-01-25T00:24:53Z,v0.1.0,2024-02-28T07:19:48Z,2026-02-25T03:10:54Z
proj_michaelgutmann_ml_pen_and_paper_exercises,ml-pen-and-paper-exercises,Pen and paper exercises in machine learning,https://github.com/michaelgutmann/ml-pen-and-paper-exercises,https://avatars.githubusercontent.com/u/19968612?u=e7138650948070c2d2809839d4e93906910114b7&v=4,,Michael Gutmann,org_michael_gutmann,https://michaelgutmann.github.io/,Custom,TeX,library,Yes,2022-06-27T16:33:05Z,,,2024-05-21T20:05:42Z
proj_seldonio_alibi,alibi,Algorithms for explaining machine learning models,https://github.com/SeldonIO/alibi,https://avatars.githubusercontent.com/u/10297834?v=4,,Seldon,org_seldon,https://seldon.io/,NOASSERTION,Python,library,Yes,2019-02-26T10:10:56Z,v0.1.0,2019-05-03T10:47:29Z,2025-10-17T13:23:21Z
proj_visualize_ml_book6_first_course_in_data_science,Book6 First Course In Data Science,Book_6_《数据有道》 |   鸢尾花书：从加减乘除到机器学习；欢迎大家批评指正！纠错多的同学会得到赠书感谢！,https://github.com/Visualize-ML/Book6_First-Course-in-Data-Science,https://avatars.githubusercontent.com/u/105787223?u=2170024995f49f224940c1b98279c7424a14fda1&v=4,,Iris Series 鸢尾花书,org_iris_series,,Custom,Jupyter Notebook,library,Yes,2022-10-11T01:24:38Z,,,2025-12-10T18:52:58Z
proj_alibaba_pipcook,pipcook,Machine learning platform for Web developers,https://github.com/alibaba/pipcook,https://avatars.githubusercontent.com/u/1961952?v=4,,Alibaba,org_alibaba,https://opensource.alibaba.com/,Apache-2.0,TypeScript,library,Yes,2019-12-05T02:40:40Z,@pipcook/boa@0.5.4,2020-04-24T02:37:14Z,2026-03-02T00:33:38Z
proj_enpeizhao_cvprojects,CVprojects,computer vision projects |  计算机视觉相关好玩的AI项目（Python、C++、embedded system）,https://github.com/enpeizhao/CVprojects,https://avatars.githubusercontent.com/u/6524256?u=3edc2c1c423f5c6b8b04177e429ab4004aa2da27&v=4,,enpeiCV,org_enpeicv,https://enpeicv.com/,Custom,Jupyter Notebook,library,Yes,2021-11-22T06:29:26Z,Models,2021-12-26T05:50:35Z,2025-12-26T12:52:58Z
proj_maximevandegar_papers_in_100_lines_of_code,Papers-in-100-Lines-of-Code,Implementation of papers in 100 lines of code.,https://github.com/MaximeVandegar/Papers-in-100-Lines-of-Code,https://avatars.githubusercontent.com/u/45870423?u=42931b2505cc48e8ca65c1715af9123c39477fac&v=4,,Maxime Vandegar,org_maxime_vandegar,,MIT,Python,library,Yes,2020-10-26T00:36:09Z,,,2026-01-22T22:55:27Z
proj_quic_aimet,aimet,AIMET is a library that provides advanced quantization and compression techniques for trained neural network models.,https://github.com/quic/aimet,https://avatars.githubusercontent.com/u/55295854?v=4,,"Qualcomm Innovation Center, Inc.",org_qualcomm_innovation_center_inc,https://qualcomm.com/developer,NOASSERTION,Python,library,Yes,2020-04-21T18:57:10Z,1.13.0,2020-12-03T19:35:57Z,2026-03-01T04:21:42Z
proj_gerdm_prml,prml,"Repository of notes, code and notebooks in Python for the book Pattern Recognition and Machine Learning by Christopher Bishop",https://github.com/gerdm/prml,https://avatars.githubusercontent.com/u/4108759?u=78547fa6a296a44b4b1663853ede5db7e7e2a281&v=4,,Gerardo Duran-Martin,org_gerardo_duran_martin,https://grdm.io/,AGPL-3.0,Jupyter Notebook,library,Yes,2018-11-23T13:35:29Z,,,2022-07-25T04:36:22Z
proj_apachecn_fe4ml_zh,fe4ml-zh,:book: [译] 面向机器学习的特征工程,https://github.com/apachecn/fe4ml-zh,https://avatars.githubusercontent.com/u/24802038?v=4,,ApacheCN,org_apachecn,https://apachecn.org/,NOASSERTION,JavaScript,library,Yes,2018-05-17T14:05:46Z,,,2023-08-25T17:00:02Z
proj_jolibrain_deepdetect,deepdetect,"Deep Learning API and Server in C++14 support for PyTorch,TensorRT, Dlib, NCNN, Tensorflow, XGBoost and TSNE",https://github.com/jolibrain/deepdetect,https://avatars.githubusercontent.com/u/25426903?v=4,,JoliBrain,org_jolibrain,https://www.jolibrain.com/,NOASSERTION,C++,library,Yes,2015-05-22T14:45:28Z,v0.9,2019-05-09T14:46:58Z,2026-01-13T10:02:13Z
proj_dmlc_gluon_nlp,gluon-nlp,NLP made easy,https://github.com/dmlc/gluon-nlp,https://avatars.githubusercontent.com/u/11508361?v=4,,Distributed (Deep) Machine Learning Community,org_distributed_deep_machine_learning_community,,Apache-2.0,Python,library,No,2018-04-04T20:57:13Z,v0.2.0,2018-05-04T18:24:58Z,2023-10-06T04:01:21Z
proj_plexe_ai_plexe,plexe,✨ Build a machine learning model from a prompt,https://github.com/plexe-ai/plexe,https://avatars.githubusercontent.com/u/183028794?v=4,,Plexe AI,org_plexe_ai,https://plexe.ai/,Apache-2.0,Python,library,Yes,2025-01-05T18:34:25Z,0.1.2,2025-01-29T23:18:46Z,2026-03-02T18:08:49Z
proj_kimmeen_time_llm,Time-LLM,"[ICLR 2024] Official implementation of "" 🦙 Time-LLM: Time Series Forecasting by Reprogramming Large Language Models""",https://github.com/KimMeen/Time-LLM,https://avatars.githubusercontent.com/u/33118451?u=713b605cdb4fc3da717e945ab14b2e237be6a9f6&v=4,,Ming Jin,org_ming_jin,https://mingjin.dev/,Apache-2.0,Python,library,Yes,2024-01-20T01:26:30Z,,,2025-10-15T11:40:18Z
proj_virginiakm1988_ml2022_spring,ML2022-Spring,**Official** 李宏毅 (Hung-yi Lee) 機器學習 Machine Learning 2022 Spring,https://github.com/virginiakm1988/ML2022-Spring,https://avatars.githubusercontent.com/u/39482819?u=6d7f4aaa2803357e3fde524512fc663f02b2571a&v=4,,Zih-Ching Chen,org_zih_ching_chen,https://medium.com/@virginiakm1988,Custom,Jupyter Notebook,library,Yes,2022-02-20T17:17:14Z,,,2022-10-18T08:57:31Z
proj_qxresearch_qxresearch_event_1,qxresearch-event-1,Python hands on tutorial with 50+ Python Application (10 lines of code) By @xiaowuc2,https://github.com/qxresearch/qxresearch-event-1,https://avatars.githubusercontent.com/u/68302830?v=4,,Qxresearch,org_qxresearch,https://qxresearch.org/,MIT,Python,library,Yes,2020-08-27T20:05:44Z,,,2024-10-26T18:44:46Z
proj_dblalock_bolt,bolt,10x faster matrix and vector operations,https://github.com/dblalock/bolt,https://avatars.githubusercontent.com/u/2422837?v=4,,Dblalock,org_dblalock,https://dblalock.substack.com/,MPL-2.0,C++,library,Yes,2017-02-01T23:11:16Z,0.1,,2022-10-12T21:47:45Z
proj_zzh8829_yolov3_tf2,yolov3-tf2,YoloV3 Implemented in Tensorflow 2.0,https://github.com/zzh8829/yolov3-tf2,https://avatars.githubusercontent.com/u/2136136?v=4,,Zihao Zhang,org_zihao_zhang,https://zihao.me/,MIT,Jupyter Notebook,library,Yes,2019-04-03T17:57:49Z,,,2024-08-30T23:51:23Z
proj_trademaster_ntu_trademaster,TradeMaster,TradeMaster is an open-source platform for quantitative trading empowered by reinforcement learning :fire: :zap: :rainbow:,https://github.com/TradeMaster-NTU/TradeMaster,https://avatars.githubusercontent.com/u/111880472?v=4,,TradeMaster-NTU,org_trademaster_ntu,,Apache-2.0,Jupyter Notebook,library,Yes,2022-08-23T13:02:43Z,v1.0.0,2023-03-05T07:24:06Z,2025-06-04T03:57:56Z
proj_aleju_papers,papers,Summaries of machine learning papers,https://github.com/aleju/papers,https://avatars.githubusercontent.com/u/11698516?v=4,,Alexander Jung,org_alexander_jung,,Custom,Unknown,library,Yes,2016-02-19T22:44:27Z,,,2020-10-29T17:10:04Z
proj_googlecloudplatform_asl_ml_immersion,asl-ml-immersion,This repos contains notebooks for the Advanced Solutions Lab: ML Immersion,https://github.com/GoogleCloudPlatform/asl-ml-immersion,https://avatars.githubusercontent.com/u/2810941?v=4,,Google Cloud Platform,org_google_cloud_platform,https://cloud.google.com/,Apache-2.0,Jupyter Notebook,library,Yes,2020-06-12T13:08:47Z,CAIP,2022-07-07T18:28:57Z,2026-03-02T17:14:18Z
proj_curiousily_getting_things_done_with_pytorch,Getting-Things-Done-with-Pytorch,"Jupyter Notebook tutorials on solving real-world problems with Machine Learning & Deep Learning using PyTorch. Topics: Face detection with Detectron 2, Time Series anomaly detection with LSTM Autoencoders, Object Detection with YOLO v5, Build your first Neural Network, Time Series forecasting for Coronavirus daily cases, Sentiment Analysis with BER",https://github.com/curiousily/Getting-Things-Done-with-Pytorch,https://avatars.githubusercontent.com/u/150327?u=8f59dc2c6da7ba39cf1157cc731020730f1e278f&v=4,,Venelin Valkov,org_venelin_valkov,https://mlexpert.io/,Apache-2.0,Jupyter Notebook,library,Yes,2020-01-31T08:02:53Z,,,2024-06-30T16:28:31Z
proj_nvidia_physicsnemo,physicsnemo,"Open-source deep-learning framework for building, training, and fine-tuning deep learning models using state-of-the-art Physics-ML methods",https://github.com/NVIDIA/physicsnemo,https://avatars.githubusercontent.com/u/1728152?v=4,,NVIDIA Corporation,org_nvidia_corporation,https://nvidia.com/,Apache-2.0,Python,library,Yes,2023-01-26T20:34:45Z,v0.1.0,2023-05-08T17:44:24Z,2026-02-27T18:12:53Z
proj_sthalles_simclr,SimCLR,PyTorch implementation of SimCLR: A Simple Framework for Contrastive Learning of Visual Representations,https://github.com/sthalles/SimCLR,https://avatars.githubusercontent.com/u/3497660?u=80798d79a462b8713a3ec2bb9155f7493b077ebd&v=4,,Thalles Silva,org_thalles_silva,,MIT,Jupyter Notebook,library,Yes,2020-02-17T18:58:35Z,v1.0.0,2021-01-18T12:34:37Z,2024-03-04T10:45:52Z
proj_hardikkamboj_an_introduction_to_statistical_learning,An-Introduction-to-Statistical-Learning,"This repository contains the exercises and its solution contained in the book ""An Introduction to Statistical Learning"" in python.",https://github.com/hardikkamboj/An-Introduction-to-Statistical-Learning,https://avatars.githubusercontent.com/u/53142482?u=87d8cbcdf7498ab12195d69205bc485eca257177&v=4,,Hardik Kamboj,org_hardik_kamboj,https://www.linkedin.com/in/hardik-kamboj-61288b19b/,Custom,Jupyter Notebook,library,Yes,2020-06-13T05:18:05Z,,,2024-09-23T08:44:58Z
proj_komputeproject_kompute,kompute,"General purpose GPU compute framework built on Vulkan to support 1000s of cross vendor graphics cards (AMD, Qualcomm, NVIDIA & friends). Blazing fast, mobile-enabled, asynchronous and optimized for advanced GPU data processing usecases. Backed by the Linux Foundation.",https://github.com/KomputeProject/kompute,https://avatars.githubusercontent.com/u/87715720?v=4,,The Kompute Project,org_the_kompute_project,https://kompute.cc/,Apache-2.0,C++,library,Yes,2020-07-29T05:23:33Z,v0.1.0,2020-08-29T13:03:03Z,2026-02-27T06:12:52Z
proj_benedekrozemberczki_awesome_decision_tree_papers,awesome-decision-tree-papers,"A collection of research papers on decision, classification and regression trees with implementations.",https://github.com/benedekrozemberczki/awesome-decision-tree-papers,https://avatars.githubusercontent.com/u/17380887?u=99ec2a50928aff6272c89af6f6881506ac70acbd&v=4,,Benedek Rozemberczki,org_benedek_rozemberczki,,CC0-1.0,Python,library,Yes,2019-05-11T18:14:03Z,v_00001,2021-05-02T18:14:37Z,2025-12-28T23:17:27Z
proj_damrsn_neuralnote,NeuralNote,Audio Plugin for Audio to MIDI transcription using deep learning.,https://github.com/DamRsn/NeuralNote,https://avatars.githubusercontent.com/u/56387835?u=0d97e6d25ba2deb54fd26b7674f4a887423d076f&v=4,,Damien Ronssin,org_damien_ronssin,,Apache-2.0,C++,library,Yes,2023-03-03T11:36:02Z,v0.0.1,2023-03-24T21:52:48Z,2025-01-16T10:00:44Z
proj_yunabe_lgo,lgo,Interactive Go programming with Jupyter,https://github.com/yunabe/lgo,https://avatars.githubusercontent.com/u/255937?u=eeae694ab14f6883225e6a199b87ad0d376ea880&v=4,,Yu Watanabe,org_yu_watanabe,https://www.yunabe.jp/docs/,BSD-3-Clause,Go,library,Yes,2017-10-05T15:29:10Z,,,2020-11-20T07:01:33Z
proj_supabase_supabase_py,supabase-py,"Python Client for Supabase. Query Postgres from Flask, Django, FastAPI. Python user authentication, security policies, edge functions, file storage, and realtime data streaming. Good first issue.",https://github.com/supabase/supabase-py,https://avatars.githubusercontent.com/u/54469796?v=4,,Supabase,org_supabase,https://supabase.com/,MIT,Python,library,Yes,2020-08-28T06:29:30Z,v0.0.2,2021-04-05T18:30:34Z,2026-02-11T12:36:15Z
proj_dorsaroh_machine_learning,Machine-Learning,ML from scratch,https://github.com/DorsaRoh/Machine-Learning,https://avatars.githubusercontent.com/u/85207154?u=2153ca955ea77b4a97488167b8e8da4df2058b90&v=4,,Dorsa Rohani,org_dorsa_rohani,https://dorsarohani.com/,MIT,Jupyter Notebook,library,Yes,2024-08-01T16:26:15Z,,,2025-08-12T22:15:36Z
proj_mckinsey_causalnex,causalnex,A Python library that helps data scientists to infer causation rather than observing correlation.,https://github.com/mckinsey/causalnex,https://avatars.githubusercontent.com/u/4265350?v=4,,Open Source by McKinsey,org_open_source_by_mckinsey,https://mckinsey.com/,NOASSERTION,Python,library,Yes,2019-12-12T15:26:09Z,0.4.0,2020-01-28T12:22:17Z,2024-06-26T08:22:56Z
proj_alan_ai_alan_sdk_web,alan-sdk-web,The Self-Coding System for Your App — Alan AI SDK for Web,https://github.com/alan-ai/alan-sdk-web,https://avatars.githubusercontent.com/u/54960780?v=4,,Alan AI,org_alan_ai,https://alan.app/platform,Custom,Unknown,library,Yes,2019-10-23T12:17:16Z,1.1.4,2020-04-24T14:42:40Z,2026-03-02T16:00:46Z
proj_aws_samples_aws_machine_learning_university_accelerated_nlp,aws-machine-learning-university-accelerated-nlp,Machine Learning University: Accelerated Natural Language Processing Class,https://github.com/aws-samples/aws-machine-learning-university-accelerated-nlp,https://avatars.githubusercontent.com/u/8931462?v=4,,AWS Samples,org_aws_samples,https://amazon.com/aws,NOASSERTION,Jupyter Notebook,library,Yes,2020-08-07T00:40:22Z,,,2024-10-13T00:49:31Z
proj_reiinakano_scikit_plot,scikit-plot,An intuitive library to add plotting functionality to scikit-learn objects.,https://github.com/reiinakano/scikit-plot,https://avatars.githubusercontent.com/u/18363734?u=c0a07ed3c9d38e5e96bdc04ce7345db1007d4f76&v=4,,Reiichiro Nakano,org_reiichiro_nakano,https://reiinakano.github.io/,MIT,Python,library,Yes,2017-02-04T06:22:59Z,v0.1.0,2017-02-17T18:12:09Z,2024-08-20T05:47:39Z
proj_pizzadedados_datascience_pizza,datascience-pizza,"🍕 Repositório para juntar informações sobre materiais de estudo em análise de dados e áreas afins, empresas que trabalham com dados e dicionário de conceitos",https://github.com/PizzaDeDados/datascience-pizza,https://avatars.githubusercontent.com/u/40184305?v=4,,Pizza De Dados,org_pizza_de_dados,http://pizzadedados.com/,MPL-2.0,Unknown,library,Yes,2017-07-18T20:37:32Z,,,2024-04-05T17:42:33Z
proj_benedekrozemberczki_awesome_community_detection,awesome-community-detection,A curated list of community detection research papers with implementations.,https://github.com/benedekrozemberczki/awesome-community-detection,https://avatars.githubusercontent.com/u/17380887?u=99ec2a50928aff6272c89af6f6881506ac70acbd&v=4,,Benedek Rozemberczki,org_benedek_rozemberczki,,CC0-1.0,Python,library,Yes,2018-10-10T15:17:30Z,v_0001,2021-05-04T20:39:26Z,2025-12-20T17:06:00Z
proj_lgsvl_simulator,simulator,A ROS/ROS2 Multi-robot Simulator for Autonomous Vehicles,https://github.com/lgsvl/simulator,https://avatars.githubusercontent.com/u/33056162?v=4,,LG Silicon Valley Lab,org_lg_silicon_valley_lab,https://www.svlsimulator.com/,NOASSERTION,C#,library,Yes,2018-07-02T22:07:26Z,2019.07-rc1,2019-08-19T22:39:59Z,2023-04-04T21:17:55Z
proj_microsoft_dialogpt,DialoGPT,Large-scale pretraining for dialogue,https://github.com/microsoft/DialoGPT,https://avatars.githubusercontent.com/u/6154722?v=4,,Microsoft,org_microsoft,https://opensource.microsoft.com/,MIT,Python,library,Yes,2019-08-29T21:07:46Z,,,2022-10-17T23:41:52Z
proj_huggingface_evaluate,evaluate,🤗 Evaluate: A library for easily evaluating machine learning models and datasets.,https://github.com/huggingface/evaluate,https://avatars.githubusercontent.com/u/25720743?v=4,,Hugging Face,org_hugging_face,https://huggingface.co/,Apache-2.0,Python,library,Yes,2022-03-30T15:08:26Z,v0.1.0,2022-05-31T13:57:20Z,2026-01-20T17:12:35Z
proj_rednaga_apkid,APKiD,"Android Application Identifier for Packers, Protectors, Obfuscators and Oddities - PEiD for Android",https://github.com/rednaga/APKiD,https://avatars.githubusercontent.com/u/10507639?v=4,,Red Naga,org_red_naga,,NOASSERTION,YARA,library,Yes,2016-06-23T18:00:21Z,v0.9.4,2016-09-26T00:01:54Z,2026-01-29T13:36:04Z
proj_jayinai_data_science_question_answer,data-science-question-answer,A repo for data science related questions and answers,https://github.com/jayinai/data-science-question-answer,https://avatars.githubusercontent.com/u/7471365?u=d22a53bdd59dae14b5d99a0cbfaf3ca8dfe6160e&v=4,,Jayinai,org_jayinai,,MIT,Jupyter Notebook,library,Yes,2018-01-15T01:39:56Z,,,2022-10-06T14:35:19Z
proj_github_codesearchnet,CodeSearchNet,"Datasets, tools, and benchmarks for representation learning of code.",https://github.com/github/CodeSearchNet,https://avatars.githubusercontent.com/u/9919?v=4,,GitHub,org_github,https://github.com/about,MIT,Jupyter Notebook,library,No,2019-02-28T17:22:54Z,,,2022-01-31T09:25:07Z
proj_apache_hamilton,hamilton,"Apache Hamilton helps data scientists and engineers define testable, modular, self-documenting dataflows, that encode lineage/tracing and metadata. Runs and scales everywhere python does.",https://github.com/apache/hamilton,https://avatars.githubusercontent.com/u/47359?v=4,,The Apache Software Foundation,org_the_apache_software_foundation,https://www.apache.org/,Apache-2.0,Jupyter Notebook,library,Yes,2023-02-23T17:16:48Z,sf-hamilton-1.18.0,2023-02-27T07:14:54Z,2026-03-01T06:59:42Z
proj_lightning_ai_torchmetrics,torchmetrics,"Machine learning metrics for distributed, scalable PyTorch applications.",https://github.com/Lightning-AI/torchmetrics,https://avatars.githubusercontent.com/u/58386951?v=4,,⚡️ Lightning AI,org_lightning_ai,https://lightning.ai/,Apache-2.0,Python,library,Yes,2020-12-22T20:02:42Z,v0.2.0,2021-03-12T13:33:41Z,2026-02-26T20:37:20Z
proj_explosion_spacy_course,spacy-course,👩‍🏫 Advanced NLP with spaCy: A free online course,https://github.com/explosion/spacy-course,https://avatars.githubusercontent.com/u/20011530?v=4,,Explosion,org_explosion,https://explosion.ai/,MIT,Python,library,Yes,2019-04-15T11:17:06Z,,,2025-02-07T07:51:14Z
proj_deeplearningturkiye_turkce_yapay_zeka_kaynaklari,turkce-yapay-zeka-kaynaklari,Türkiye'de yapılan derin öğrenme (deep learning) ve makine öğrenmesi (machine learning) çalışmalarının derlendiği sayfa.,https://github.com/deeplearningturkiye/turkce-yapay-zeka-kaynaklari,https://avatars.githubusercontent.com/u/32883077?u=e60275a92165e82023ddbbe52028aa97c9bb36fe&v=4,,Deep Learning Türkiye,org_deep_learning_t_rkiye,http://deeplearningturkiye.com/,MIT,Unknown,library,Yes,2017-10-17T20:19:31Z,,,2021-11-03T08:50:52Z
proj_tryolabs_luminoth,luminoth,Deep Learning toolkit for Computer Vision.,https://github.com/tryolabs/luminoth,https://avatars.githubusercontent.com/u/591820?v=4,,Tryolabs,org_tryolabs,https://tryolabs.com/,BSD-3-Clause,Python,library,Yes,2017-02-16T15:07:46Z,v0.0.1,2017-10-10T21:40:56Z,2023-03-24T23:52:00Z
proj_hitsz_ids_synthetic_data_generator,synthetic-data-generator,SDG is a specialized framework designed to generate high-quality structured tabular data.,https://github.com/hitsz-ids/synthetic-data-generator,https://avatars.githubusercontent.com/u/55747983?v=4,,小王同学在积累,org_community,http://ir.hit.edu.cn/,Apache-2.0,Python,library,Yes,2023-08-10T03:08:07Z,0.0.0a0,2023-08-11T03:15:21Z,2026-03-02T18:31:08Z
proj_metarank_metarank,metarank,"A low code Machine Learning personalized ranking service for articles, listings, search results, recommendations that boosts user engagement. A friendly Learn-to-Rank engine",https://github.com/metarank/metarank,https://avatars.githubusercontent.com/u/72728171?v=4,,Metarank Labs Co.,org_metarank_labs_co,https://www.metarank.ai/,Apache-2.0,Scala,library,Yes,2020-08-19T17:16:08Z,0.2.0,2022-02-11T16:09:52Z,2025-09-24T16:56:42Z
proj_unslothai_hyperlearn,hyperlearn,"2-2000x faster ML algos, 50% less memory usage, works on all hardware - new and old.",https://github.com/unslothai/hyperlearn,https://avatars.githubusercontent.com/u/150920049?v=4,,Unsloth AI,org_unsloth_ai,https://unsloth.ai/,Apache-2.0,Jupyter Notebook,library,Yes,2018-08-27T16:00:47Z,,,2024-11-19T02:09:54Z
proj_akuity_awesome_argo,awesome-argo,A curated list of awesome projects and resources related to Argo (a CNCF graduated project),https://github.com/akuity/awesome-argo,https://avatars.githubusercontent.com/u/84434210?v=4,,Akuity,org_akuity,https://akuity.io/,Apache-2.0,Unknown,library,Yes,2021-11-01T01:10:19Z,,,2026-02-28T03:02:12Z
proj_learning_at_home_hivemind,hivemind,Decentralized deep learning in PyTorch. Built to train models on thousands of volunteers across the world.,https://github.com/learning-at-home/hivemind,https://avatars.githubusercontent.com/u/61500353?v=4,,Learning@home,org_learning_home,,MIT,Python,library,Yes,2020-02-27T13:50:19Z,v0.7.1,2020-08-16T17:20:00Z,2026-01-11T21:13:45Z
proj_asyml_texar,texar,"Toolkit for Machine Learning, Natural Language Processing, and Text Generation, in TensorFlow.  This is part of the CASL project: http://casl-project.ai/",https://github.com/asyml/texar,https://avatars.githubusercontent.com/u/42220794?v=4,,ASYML,org_asyml,https://asyml.io/,Apache-2.0,Python,library,Yes,2017-07-22T19:02:05Z,v0.1.0,2019-02-06T20:27:24Z,2021-08-26T09:49:50Z
proj_brikerman_kashgari,Kashgari,"Kashgari is a production-level NLP Transfer learning framework built on top of tf.keras for text-labeling and text-classification, includes Word2Vec, BERT, and GPT2 Language Embedding.",https://github.com/BrikerMan/Kashgari,https://avatars.githubusercontent.com/u/9368907?u=d8f24216ac70945936bb32e0698377d5f3a01a19&v=4,,Eliyar Eziz,org_eliyar_eziz,https://eliyar.biz/,Apache-2.0,Python,library,Yes,2019-01-19T01:53:28Z,v0.1.5,2019-01-31T08:13:28Z,2024-09-03T21:05:29Z
proj_hedgehog_computing_hedgehog_lab,hedgehog-lab,"Run, compile and execute JavaScript for Scientific Computing and Data Visualization TOTALLY TOTALLY TOTALLY in your BROWSER! An open source scientific computing environment for JavaScript TOTALLY in your browser, matrix operations with GPU acceleration, TeX support, data visualization and symbolic computation.",https://github.com/Hedgehog-Computing/hedgehog-lab,https://avatars.githubusercontent.com/u/68457373?v=4,,Hedgehog Computing,org_hedgehog_computing,http://hlab.app/,Apache-2.0,TypeScript,library,Yes,2020-05-13T05:40:18Z,v0.7.0,2020-07-25T10:49:30Z,2024-05-02T16:29:14Z
proj_erickwendel_semana_javascript_expert07,semana-javascript-expert07,JS Expert Week 7.0 - 🙅🤏🏻 Controlling Streaming Platforms using Eye and Hand Detection 👁🖐,https://github.com/ErickWendel/semana-javascript-expert07,https://avatars.githubusercontent.com/u/8060102?u=de3bfaa57ccc7f15a33b67ea1bd86b76e5cebdda&v=4,,Erick Wendel,org_erick_wendel,https://erickwendel.com/,Custom,JavaScript,library,Yes,2023-02-26T22:32:48Z,,,2023-12-12T13:50:14Z
proj_dipanjans_practical_machine_learning_with_python,practical-machine-learning-with-python,Master the essential skills needed to recognize and solve complex real-world problems with Machine Learning and Deep Learning by leveraging the highly popular Python Machine Learning Eco-system.,https://github.com/dipanjanS/practical-machine-learning-with-python,https://avatars.githubusercontent.com/u/3448263?u=f07435e2abd0f1d9fc9e4472aa2275d1292b3541&v=4,,Dipanjan (DJ) Sarkar,org_dipanjan_dj_sarkar,,Apache-2.0,Jupyter Notebook,library,Yes,2017-07-29T10:31:36Z,,,2024-03-31T20:24:30Z
proj_torchio_project_torchio,torchio,Medical imaging processing for AI applications.,https://github.com/TorchIO-project/torchio,https://avatars.githubusercontent.com/u/75942974?v=4,,TorchIO,org_torchio,https://torchio.org/,Apache-2.0,Python,library,Yes,2019-11-26T09:10:09Z,v0.7.0,2020-01-06T17:14:05Z,2026-03-01T19:02:45Z
proj_eon01_awesome_chatgpt,awesome-chatgpt,"🧠 A curated list of awesome ChatGPT resources, including libraries, SDKs, APIs, and more. 🌟 Please consider supporting this project by giving it a star.",https://github.com/eon01/awesome-chatgpt,https://avatars.githubusercontent.com/u/5774128?u=4440b704cc7d7327a56ab9dcac33d82317a60f45&v=4,,Aymen El Amri,org_aymen_el_amri,https://faun.dev/@eon01,NOASSERTION,Unknown,library,Yes,2022-12-20T16:14:19Z,,,2026-02-26T22:01:56Z
proj_scverse_scanpy,scanpy,Single-cell analysis in Python. Scales to >100M cells.,https://github.com/scverse/scanpy,https://avatars.githubusercontent.com/u/95305807?v=4,,Scverse,org_scverse,https://scverse.org/,BSD-3-Clause,Python,library,Yes,2017-01-29T11:31:11Z,0.0,2023-08-25T07:50:11Z,2026-03-02T17:59:09Z
